{"evidence_id": "E-0000", "source_id": "S-0000", "citation": "Sobrenome (Ano)", "doi": "NR — não reportado", "url": "NR — não reportado", "page": "NR — não reportado", "section": "NR — não reportado", "excerpt": "trecho literal", "claim_supported": "afirmação exata sustentada", "evidence_type": "source_evidence", "method": "NR — não reportado", "design_class": "NR — não reportado", "context": {"country": "NR — não reportado", "population": "NR — não reportado", "period": "NR — não reportado", "sector": "NR — não reportado"}, "quantitative_result": "NR — não reportado", "verification_status": "UNVERIFIED", "verified_by": "PREENCHER", "verified_on": "PREENCHER", "used_in": [], "notes": "modelo"}
